{
  "schema": "urn:algaguard:schema:onboarding:credential-status:v1",
  "schemaVersion": "1.0.0",
  "deviceUuid": "aaaaaaaa-aaaa-4aaa-8aaa-aaaaaaaaaaaa",
  "deviceId": "AG-000001",
  "lifecycleStatus": "ACTIVE",
  "activeCredentialIds": ["11111111-1111-4111-8111-111111111111"],
  "rotationId": null,
  "rotationExpiresAt": null,
  "recoveryRequired": false,
  "updatedAt": "2026-07-24T00:00:05Z"
}
